{
  "$schema": "http://json-schema.org/draft-07/schema#",
  "$id": "https://pooltogether.com/prizeAPI.schema.json",
  "title": "PoolTogethers Prize API Schema",
  "description": "Schema for the Prize API",
  "type": "object",
  "additionalProperties": false,
  "properties": {
    "address": {
      "type": "string",
      "description": "The lowercase users address",
      "length": 42,
      "examples": ["0xa5c3a513645a9a00cb561fed40438e9dfe0d6a69"]
    },
    "pick": {
      "type": "string",
      "description": "The user's pick for this prize",
      "minLength": 1,
      "maxLength": 42
    },
    "tier": {
      "type": "number",
      "description": "The prize tier of this prize"
    },
    "amount": {
      "type": "string",
      "description": "The amount of the prize",
      "minLength": 1,
      "maxLength": 42
    }
  },
  "required": ["address", "pick", "tier", "amount"]
}
