[
  {
    "address": "0x3fed71848b74b9f3ff26544cad368c082cb31961",
    "pick": "2224",
    "tier": 5,
    "amount": "4999999"
  },
  {
    "address": "0x3fed71848b74b9f3ff26544cad368c082cb31961",
    "pick": "4843",
    "tier": 6,
    "amount": "999999"
  },
  {
    "address": "0x3fed71848b74b9f3ff26544cad368c082cb31961",
    "pick": "7927",
    "tier": 6,
    "amount": "999999"
  },
  {
    "address": "0x3fed71848b74b9f3ff26544cad368c082cb31961",
    "pick": "12010",
    "tier": 5,
    "amount": "4999999"
  },
  {
    "address": "0x3fed71848b74b9f3ff26544cad368c082cb31961",
    "pick": "12255",
    "tier": 5,
    "amount": "4999999"
  },
  {
    "address": "0x3fed71848b74b9f3ff26544cad368c082cb31961",
    "pick": "27736",
    "tier": 6,
    "amount": "999999"
  },
  {
    "address": "0x3fed71848b74b9f3ff26544cad368c082cb31961",
    "pick": "34030",
    "tier": 5,
    "amount": "4999999"
  },
  {
    "address": "0x3fed71848b74b9f3ff26544cad368c082cb31961",
    "pick": "36665",
    "tier": 5,
    "amount": "4999999"
  },
  {
    "address": "0x3fed71848b74b9f3ff26544cad368c082cb31961",
    "pick": "42534",
    "tier": 6,
    "amount": "999999"
  },
  {
    "address": "0x3fed71848b74b9f3ff26544cad368c082cb31961",
    "pick": "45643",
    "tier": 6,
    "amount": "999999"
  },
  {
    "address": "0x3fed71848b74b9f3ff26544cad368c082cb31961",
    "pick": "51324",
    "tier": 5,
    "amount": "4999999"
  },
  {
    "address": "0x3fed71848b74b9f3ff26544cad368c082cb31961",
    "pick": "51925",
    "tier": 6,
    "amount": "999999"
  }
]