[
  {
    "address": "0x0839519639d7bcc95f64b481ed06e180f258ebb1",
    "pick": "5923",
    "tier": 5,
    "amount": "4999999"
  },
  {
    "address": "0x0839519639d7bcc95f64b481ed06e180f258ebb1",
    "pick": "9330",
    "tier": 6,
    "amount": "999999"
  },
  {
    "address": "0x0839519639d7bcc95f64b481ed06e180f258ebb1",
    "pick": "12102",
    "tier": 6,
    "amount": "999999"
  },
  {
    "address": "0x0839519639d7bcc95f64b481ed06e180f258ebb1",
    "pick": "12724",
    "tier": 6,
    "amount": "999999"
  }
]