[
  {
    "address": "0x0f35af1184282eaffe1304c5f98158175f7f5889",
    "pick": "957",
    "tier": 6,
    "amount": "999999"
  },
  {
    "address": "0x0f35af1184282eaffe1304c5f98158175f7f5889",
    "pick": "1094",
    "tier": 6,
    "amount": "999999"
  },
  {
    "address": "0x0f35af1184282eaffe1304c5f98158175f7f5889",
    "pick": "2443",
    "tier": 5,
    "amount": "4999999"
  },
  {
    "address": "0x0f35af1184282eaffe1304c5f98158175f7f5889",
    "pick": "5020",
    "tier": 6,
    "amount": "999999"
  }
]