[
  {
    "address": "0x38742d8717c57dc7ba97e2df7a61e26c3412ffdd",
    "pick": "8092",
    "tier": 6,
    "amount": "999999"
  },
  {
    "address": "0x38742d8717c57dc7ba97e2df7a61e26c3412ffdd",
    "pick": "24029",
    "tier": 6,
    "amount": "999999"
  },
  {
    "address": "0x38742d8717c57dc7ba97e2df7a61e26c3412ffdd",
    "pick": "30919",
    "tier": 6,
    "amount": "999999"
  },
  {
    "address": "0x38742d8717c57dc7ba97e2df7a61e26c3412ffdd",
    "pick": "43253",
    "tier": 6,
    "amount": "999999"
  },
  {
    "address": "0x38742d8717c57dc7ba97e2df7a61e26c3412ffdd",
    "pick": "43488",
    "tier": 5,
    "amount": "4999999"
  },
  {
    "address": "0x38742d8717c57dc7ba97e2df7a61e26c3412ffdd",
    "pick": "48611",
    "tier": 6,
    "amount": "999999"
  }
]