[
  {
    "address": "0xded0e76f559e39ff5dff607b0d58dcf86b0b58d9",
    "pick": "1849",
    "tier": 5,
    "amount": "4999999"
  },
  {
    "address": "0xded0e76f559e39ff5dff607b0d58dcf86b0b58d9",
    "pick": "1857",
    "tier": 6,
    "amount": "999999"
  },
  {
    "address": "0xded0e76f559e39ff5dff607b0d58dcf86b0b58d9",
    "pick": "8010",
    "tier": 6,
    "amount": "999999"
  }
]