[
  {
    "address": "0xadc12cc6a97a81c656bcdedfaf6bbd16a36cb9b3",
    "pick": "1426",
    "tier": 6,
    "amount": "999999"
  },
  {
    "address": "0xadc12cc6a97a81c656bcdedfaf6bbd16a36cb9b3",
    "pick": "2505",
    "tier": 6,
    "amount": "999999"
  },
  {
    "address": "0xadc12cc6a97a81c656bcdedfaf6bbd16a36cb9b3",
    "pick": "2964",
    "tier": 6,
    "amount": "999999"
  },
  {
    "address": "0xadc12cc6a97a81c656bcdedfaf6bbd16a36cb9b3",
    "pick": "5430",
    "tier": 6,
    "amount": "999999"
  },
  {
    "address": "0xadc12cc6a97a81c656bcdedfaf6bbd16a36cb9b3",
    "pick": "7845",
    "tier": 6,
    "amount": "999999"
  }
]