[
  {
    "address": "0xf756e4368a03627eac9b0c474c8420794f429ba1",
    "pick": "2700",
    "tier": 5,
    "amount": "9999999"
  },
  {
    "address": "0xf756e4368a03627eac9b0c474c8420794f429ba1",
    "pick": "4229",
    "tier": 5,
    "amount": "9999999"
  },
  {
    "address": "0xf756e4368a03627eac9b0c474c8420794f429ba1",
    "pick": "4266",
    "tier": 5,
    "amount": "9999999"
  }
]