[
  {
    "address": "0x7e784506087d8336e34223b0ca998aa6f666fb39",
    "pick": "2702",
    "tier": 6,
    "amount": "999999"
  },
  {
    "address": "0x7e784506087d8336e34223b0ca998aa6f666fb39",
    "pick": "9327",
    "tier": 5,
    "amount": "4999999"
  },
  {
    "address": "0x7e784506087d8336e34223b0ca998aa6f666fb39",
    "pick": "9526",
    "tier": 5,
    "amount": "4999999"
  },
  {
    "address": "0x7e784506087d8336e34223b0ca998aa6f666fb39",
    "pick": "9764",
    "tier": 6,
    "amount": "999999"
  },
  {
    "address": "0x7e784506087d8336e34223b0ca998aa6f666fb39",
    "pick": "22407",
    "tier": 6,
    "amount": "999999"
  }
]