[
  {
    "address": "0x559524b8d5af5292e4ca30b30ea3dc8261e1dea4",
    "pick": "815",
    "tier": 4,
    "amount": "9999999"
  },
  {
    "address": "0x559524b8d5af5292e4ca30b30ea3dc8261e1dea4",
    "pick": "5598",
    "tier": 5,
    "amount": "4999999"
  },
  {
    "address": "0x559524b8d5af5292e4ca30b30ea3dc8261e1dea4",
    "pick": "16913",
    "tier": 5,
    "amount": "4999999"
  }
]