[
  {
    "address": "0x685c66df2a77fbc188371b3470d5a2adca538a03",
    "pick": "684",
    "tier": 5,
    "amount": "9999999"
  },
  {
    "address": "0x685c66df2a77fbc188371b3470d5a2adca538a03",
    "pick": "5565",
    "tier": 5,
    "amount": "9999999"
  },
  {
    "address": "0x685c66df2a77fbc188371b3470d5a2adca538a03",
    "pick": "6050",
    "tier": 5,
    "amount": "9999999"
  },
  {
    "address": "0x685c66df2a77fbc188371b3470d5a2adca538a03",
    "pick": "7732",
    "tier": 5,
    "amount": "9999999"
  },
  {
    "address": "0x685c66df2a77fbc188371b3470d5a2adca538a03",
    "pick": "7865",
    "tier": 5,
    "amount": "9999999"
  },
  {
    "address": "0x685c66df2a77fbc188371b3470d5a2adca538a03",
    "pick": "9331",
    "tier": 5,
    "amount": "9999999"
  },
  {
    "address": "0x685c66df2a77fbc188371b3470d5a2adca538a03",
    "pick": "9922",
    "tier": 5,
    "amount": "9999999"
  },
  {
    "address": "0x685c66df2a77fbc188371b3470d5a2adca538a03",
    "pick": "10289",
    "tier": 5,
    "amount": "9999999"
  },
  {
    "address": "0x685c66df2a77fbc188371b3470d5a2adca538a03",
    "pick": "11829",
    "tier": 5,
    "amount": "9999999"
  },
  {
    "address": "0x685c66df2a77fbc188371b3470d5a2adca538a03",
    "pick": "12916",
    "tier": 5,
    "amount": "9999999"
  },
  {
    "address": "0x685c66df2a77fbc188371b3470d5a2adca538a03",
    "pick": "13416",
    "tier": 5,
    "amount": "9999999"
  },
  {
    "address": "0x685c66df2a77fbc188371b3470d5a2adca538a03",
    "pick": "14199",
    "tier": 5,
    "amount": "9999999"
  }
]