[
  {
    "address": "0xc80aa78dc2ad53a0db4653de027d15e5e3ea646a",
    "pick": "33",
    "tier": 5,
    "amount": "9999999"
  },
  {
    "address": "0xc80aa78dc2ad53a0db4653de027d15e5e3ea646a",
    "pick": "3178",
    "tier": 3,
    "amount": "99999999"
  },
  {
    "address": "0xc80aa78dc2ad53a0db4653de027d15e5e3ea646a",
    "pick": "9568",
    "tier": 5,
    "amount": "9999999"
  },
  {
    "address": "0xc80aa78dc2ad53a0db4653de027d15e5e3ea646a",
    "pick": "24405",
    "tier": 5,
    "amount": "9999999"
  },
  {
    "address": "0xc80aa78dc2ad53a0db4653de027d15e5e3ea646a",
    "pick": "27499",
    "tier": 5,
    "amount": "9999999"
  },
  {
    "address": "0xc80aa78dc2ad53a0db4653de027d15e5e3ea646a",
    "pick": "28971",
    "tier": 5,
    "amount": "9999999"
  },
  {
    "address": "0xc80aa78dc2ad53a0db4653de027d15e5e3ea646a",
    "pick": "35620",
    "tier": 5,
    "amount": "9999999"
  },
  {
    "address": "0xc80aa78dc2ad53a0db4653de027d15e5e3ea646a",
    "pick": "35720",
    "tier": 5,
    "amount": "9999999"
  }
]