[
  {
    "address": "0x647f6ac07c1ee66c025295e71e45a17f9b0aae94",
    "pick": "2475",
    "tier": 5,
    "amount": "4999999"
  },
  {
    "address": "0x647f6ac07c1ee66c025295e71e45a17f9b0aae94",
    "pick": "2533",
    "tier": 5,
    "amount": "4999999"
  },
  {
    "address": "0x647f6ac07c1ee66c025295e71e45a17f9b0aae94",
    "pick": "6853",
    "tier": 5,
    "amount": "4999999"
  }
]