[
  {
    "address": "0xbad858a0cf09f210fcf35cbf83569178879b47f2",
    "pick": "271",
    "tier": 5,
    "amount": "4999999"
  },
  {
    "address": "0xbad858a0cf09f210fcf35cbf83569178879b47f2",
    "pick": "4253",
    "tier": 6,
    "amount": "999999"
  },
  {
    "address": "0xbad858a0cf09f210fcf35cbf83569178879b47f2",
    "pick": "4738",
    "tier": 6,
    "amount": "999999"
  },
  {
    "address": "0xbad858a0cf09f210fcf35cbf83569178879b47f2",
    "pick": "6153",
    "tier": 6,
    "amount": "999999"
  },
  {
    "address": "0xbad858a0cf09f210fcf35cbf83569178879b47f2",
    "pick": "8065",
    "tier": 5,
    "amount": "4999999"
  },
  {
    "address": "0xbad858a0cf09f210fcf35cbf83569178879b47f2",
    "pick": "8435",
    "tier": 4,
    "amount": "9999999"
  },
  {
    "address": "0xbad858a0cf09f210fcf35cbf83569178879b47f2",
    "pick": "9037",
    "tier": 6,
    "amount": "999999"
  },
  {
    "address": "0xbad858a0cf09f210fcf35cbf83569178879b47f2",
    "pick": "10578",
    "tier": 6,
    "amount": "999999"
  },
  {
    "address": "0xbad858a0cf09f210fcf35cbf83569178879b47f2",
    "pick": "13190",
    "tier": 6,
    "amount": "999999"
  },
  {
    "address": "0xbad858a0cf09f210fcf35cbf83569178879b47f2",
    "pick": "20176",
    "tier": 6,
    "amount": "999999"
  },
  {
    "address": "0xbad858a0cf09f210fcf35cbf83569178879b47f2",
    "pick": "20473",
    "tier": 4,
    "amount": "9999999"
  }
]