[
  {
    "address": "0xce84ef39bac143084969bba51a06bdff375f257e",
    "pick": "4546",
    "tier": 5,
    "amount": "4999999"
  },
  {
    "address": "0xce84ef39bac143084969bba51a06bdff375f257e",
    "pick": "33906",
    "tier": 3,
    "amount": "49999999"
  },
  {
    "address": "0xce84ef39bac143084969bba51a06bdff375f257e",
    "pick": "34665",
    "tier": 5,
    "amount": "4999999"
  },
  {
    "address": "0xce84ef39bac143084969bba51a06bdff375f257e",
    "pick": "58633",
    "tier": 5,
    "amount": "4999999"
  },
  {
    "address": "0xce84ef39bac143084969bba51a06bdff375f257e",
    "pick": "80555",
    "tier": 5,
    "amount": "4999999"
  }
]