[
  {
    "address": "0xbd5e252a9fbb630c6fddf1c34997361310d35089",
    "pick": "1806",
    "tier": 3,
    "amount": "49999999"
  },
  {
    "address": "0xbd5e252a9fbb630c6fddf1c34997361310d35089",
    "pick": "5823",
    "tier": 5,
    "amount": "4999999"
  },
  {
    "address": "0xbd5e252a9fbb630c6fddf1c34997361310d35089",
    "pick": "11955",
    "tier": 5,
    "amount": "4999999"
  }
]