[
  {
    "address": "0xab6dc3f226b98b67063e7414ba196744209a65bc",
    "pick": "266",
    "tier": 6,
    "amount": "999999"
  },
  {
    "address": "0xab6dc3f226b98b67063e7414ba196744209a65bc",
    "pick": "4273",
    "tier": 6,
    "amount": "999999"
  },
  {
    "address": "0xab6dc3f226b98b67063e7414ba196744209a65bc",
    "pick": "6860",
    "tier": 6,
    "amount": "999999"
  }
]