[
  {
    "address": "0xc6bf9a296f7477a45c660d692362b4f4c72d76a1",
    "pick": "3936",
    "tier": 6,
    "amount": "999999"
  },
  {
    "address": "0xc6bf9a296f7477a45c660d692362b4f4c72d76a1",
    "pick": "5722",
    "tier": 6,
    "amount": "999999"
  },
  {
    "address": "0xc6bf9a296f7477a45c660d692362b4f4c72d76a1",
    "pick": "5976",
    "tier": 6,
    "amount": "999999"
  },
  {
    "address": "0xc6bf9a296f7477a45c660d692362b4f4c72d76a1",
    "pick": "6808",
    "tier": 6,
    "amount": "999999"
  }
]