[
  {
    "address": "0x0acaa7e46a164d1b371326416b2d555cb13faa28",
    "pick": "825",
    "tier": 5,
    "amount": "4999999"
  },
  {
    "address": "0x0acaa7e46a164d1b371326416b2d555cb13faa28",
    "pick": "5040",
    "tier": 5,
    "amount": "4999999"
  },
  {
    "address": "0x0acaa7e46a164d1b371326416b2d555cb13faa28",
    "pick": "7158",
    "tier": 5,
    "amount": "4999999"
  }
]