[
  {
    "address": "0xcfd92e7ec4733e428a34b9ae10f1dc0fe15c92fa",
    "pick": "3454",
    "tier": 5,
    "amount": "4999999"
  },
  {
    "address": "0xcfd92e7ec4733e428a34b9ae10f1dc0fe15c92fa",
    "pick": "4058",
    "tier": 5,
    "amount": "4999999"
  },
  {
    "address": "0xcfd92e7ec4733e428a34b9ae10f1dc0fe15c92fa",
    "pick": "5863",
    "tier": 4,
    "amount": "9999999"
  }
]