[
  {
    "address": "0x0e9dd59448f53fa240dfd7a217f58d4d5efaff16",
    "pick": "1098",
    "tier": 4,
    "amount": "4999999"
  },
  {
    "address": "0x0e9dd59448f53fa240dfd7a217f58d4d5efaff16",
    "pick": "14332",
    "tier": 4,
    "amount": "4999999"
  },
  {
    "address": "0x0e9dd59448f53fa240dfd7a217f58d4d5efaff16",
    "pick": "35144",
    "tier": 5,
    "amount": "5000000"
  }
]