[
  {
    "address": "0xc8f88b4aef57ac93fe41390194c3a4d77d7df744",
    "pick": "1334",
    "tier": 5,
    "amount": "9999999"
  },
  {
    "address": "0xc8f88b4aef57ac93fe41390194c3a4d77d7df744",
    "pick": "5837",
    "tier": 5,
    "amount": "9999999"
  },
  {
    "address": "0xc8f88b4aef57ac93fe41390194c3a4d77d7df744",
    "pick": "6122",
    "tier": 5,
    "amount": "9999999"
  },
  {
    "address": "0xc8f88b4aef57ac93fe41390194c3a4d77d7df744",
    "pick": "6890",
    "tier": 5,
    "amount": "9999999"
  },
  {
    "address": "0xc8f88b4aef57ac93fe41390194c3a4d77d7df744",
    "pick": "7254",
    "tier": 5,
    "amount": "9999999"
  }
]